<?xml version="1.0" encoding="UTF-8"?>
<!-- Rev 1.08 
	Delete <info> and <example> elements
-->
<!-- Rev 1.07 
	Revised POS tags for the adjectives
-->
<!-- Rev 1.06 
	Dropped the "*" from the end of the entry element.
	Dropped the g_lang attribute in favour of xml:lang
	Dropped the <lang> element and replaced it with <lsource> at the
	sense level.
	Moved <dial> from the entry level to the sense level.
	Changed "info*" to "info?".
-->
<!-- Rev 1.05 
	Changed the <gram> element name to <pos>
	Added the g_gend attribute
	moved the s_inf element
-->
<!-- Rev 1.04 
	Changes:
     Rename the project  "JMdict" and add the g_lang attribute to the 
	<gloss> entity - 08 May 1999 
     Moved the <gram>, <field> and <misc> elements down to be in the
     <sense> region, as suggested by Chris Czeyka. I have also tidied up
     some of the "*" as he suggested.  - 27 May 2000
	 Added the re_nokanji element - Sep 2003.
     -->
<!DOCTYPE JMdict [
<!ELEMENT JMdict (entry*)>
<!--                                                                   -->
<!ELEMENT entry (ent_seq, k_ele*, r_ele+, sense+)>
	<!-- Entries consist of kanji elements, reading elements, 
	general information and sense elements. Each entry must have at 
	least one reading element and one sense element. Others are optional.
	-->
<!ELEMENT ent_seq (#PCDATA)>
	<!-- A unique numeric sequence number for each entry
	-->
<!ELEMENT k_ele (keb, ke_inf*, ke_pri*)>
	<!-- The kanji element, or in its absence, the reading element, is 
	the defining component of each entry.
	The overwhelming majority of entries will have a single kanji
	element associated with a word in Japanese. Where there are 
	multiple kanji elements within an entry, they will be orthographical
	variants of the same word, either using variations in okurigana, or
	alternative and equivalent kanji. Common "mis-spellings" may be 
	included, provided they are associated with appropriate information
	fields. Synonyms are not included; they may be indicated in the
	cross-reference field associated with the sense element.
	-->
<!ELEMENT keb (#PCDATA)>
	<!-- This element will contain a word or short phrase in Japanese 
	which is written using at least one non-kana character (usually kanji,
	but can be other characters). The valid characters are
	kanji, kana, related characters such as chouon and kurikaeshi, and
	in exceptional cases, letters from other alphabets.
	-->
<!ELEMENT ke_inf (#PCDATA)>
	<!-- This is a coded information field related specifically to the 
	orthography of the keb, and will typically indicate some unusual
	aspect, such as okurigana irregularity.
	-->
<!ELEMENT ke_pri (#PCDATA)>
	<!-- This and the equivalent re_pri field are provided to record
	information about the relative priority of the entry,  and consist
	of codes indicating the word appears in various references which
	can be taken as an indication of the frequency with which the word
	is used. This field is intended for use either by applications which 
	want to concentrate on entries of  a particular priority, or to 
	generate subset files. 
	The current values in this field are:
	- news1/2: appears in the "wordfreq" file compiled by Alexandre Girardi
	from the Mainichi Shimbun. (See the Monash ftp archive for a copy.)
	Words in the first 12,000 in that file are marked "news1" and words 
	in the second 12,000 are marked "news2".
	- ichi1/2: appears in the "Ichimango goi bunruishuu", Senmon Kyouiku 
	Publishing, Tokyo, 1998.  (The entries marked "ichi2" were
	demoted from ichi1 because they were observed to have low
	frequencies in the WWW and newspapers.)
	- spec1 and spec2: a small number of words use this marker when they 
	are detected as being common, but are not included in other lists.
	- gai1/2: common loanwords, based on the wordfreq file.
	- nfxx: this is an indicator of frequency-of-use ranking in the
	wordfreq file. "xx" is the number of the set of 500 words in which
	the entry can be found, with "01" assigned to the first 500, "02"
	to the second, and so on. (The entries with news1, ichi1, spec1, spec2
	and gai1 values are marked with a "(P)" in the EDICT and EDICT2
	files.)

	The reason both the kanji and reading elements are tagged is because 
	on occasions a priority is only associated with a particular
	kanji/reading pair.
	-->
<!--                                                                   -->
<!ELEMENT r_ele (reb, re_nokanji?, re_restr*, re_inf*, re_pri*)>
	<!-- The reading element typically contains the valid readings
	of the word(s) in the kanji element using modern kanadzukai. 
	Where there are multiple reading elements, they will typically be
	alternative readings of the kanji element. In the absence of a 
	kanji element, i.e. in the case of a word or phrase written
	entirely in kana, these elements will define the entry.
	-->
<!ELEMENT reb (#PCDATA)>
	<!-- this element content is restricted to kana and related
	characters such as chouon and kurikaeshi. Kana usage will be
	consistent between the keb and reb elements; e.g. if the keb
	contains katakana, so too will the reb.
	-->
<!ELEMENT re_nokanji (#PCDATA)>
	<!-- This element, which will usually have a null value, indicates
	that the reb, while associated with the keb, cannot be regarded
	as a true reading of the kanji. It is typically used for words
	such as foreign place names, gairaigo which can be in kanji or
	katakana, etc.
	-->
<!ELEMENT re_restr (#PCDATA)>
	<!-- This element is used to indicate when the reading only applies
	to a subset of the keb elements in the entry. In its absence, all
	readings apply to all kanji elements. The contents of this element 
	must exactly match those of one of the keb elements.
	-->
<!ELEMENT re_inf (#PCDATA)>
	<!-- General coded information pertaining to the specific reading.
	Typically it will be used to indicate some unusual aspect of 
	the reading. -->
<!ELEMENT re_pri (#PCDATA)>
	<!-- See the comment on ke_pri above. -->
<!--                                                                   -->
<!ELEMENT sense (stagk*, stagr*, pos*, xref*, ant*, field*, misc*, s_inf*, lsource*, dial*, gloss*)>
	<!-- The sense element will record the translational equivalent
	of the Japanese word, plus other related information. Where there
	are several distinctly different meanings of the word, multiple
	sense elements will be employed.
	-->
<!ELEMENT stagk (#PCDATA)>
<!ELEMENT stagr (#PCDATA)>
	<!-- These elements, if present, indicate that the sense is restricted
	to the lexeme represented by the keb and/or reb. -->
<!ELEMENT xref (#PCDATA)*>
	<!-- This element is used to indicate a cross-reference to another
	entry with a similar or related meaning or sense. The content of
	this element is typically a keb or reb element in another entry. In some
	cases a keb will be followed by a reb and/or a sense number to provide
	a precise target for the cross-reference. Where this happens, a JIS
	"centre-dot" (0x2126) is placed between the components of the 
	cross-reference.
	-->
<!ELEMENT ant (#PCDATA)*>
	<!-- This element is used to indicate another entry which is an
	antonym of the current entry/sense. The content of this element
	must exactly match that of a keb or reb element in another entry.
	-->
<!ELEMENT pos (#PCDATA)>
	<!-- Part-of-speech information about the entry/sense. Should use 
	appropriate entity codes. In general where there are multiple senses
	in an entry, the part-of-speech of an earlier sense will apply to
	later senses unless there is a new part-of-speech indicated.
	-->
<!ELEMENT field (#PCDATA)>
	<!-- Information about the field of application of the entry/sense. 
	When absent, general application is implied. Entity coding for 
	specific fields of application. -->
<!ELEMENT misc (#PCDATA)>
	<!-- This element is used for other relevant information about 
	the entry/sense. As with part-of-speech, information will usually
	apply to several senses.
	-->
<!ELEMENT lsource (#PCDATA)>
	<!-- This element records the information about the source
	language(s) of a loan-word/gairaigo. If the source language is other 
	than English, the language is indicated by the xml:lang attribute.
	The element value (if any) is the source word or phrase.
	-->
<!ATTLIST lsource xml:lang CDATA "eng">
	<!-- The xml:lang attribute defines the language(s) from which
	a loanword is drawn.  It will be coded using the three-letter language 
	code from the ISO 639-2 standard. When absent, the value "eng" (i.e. 
	English) is the default value. The bibliographic (B) codes are used. -->
<!ATTLIST lsource ls_type CDATA #IMPLIED>
	<!-- The ls_type attribute indicates whether the lsource element
	fully or partially describes the source word or phrase of the
	loanword. If absent, it will have the implied value of "full".
	Otherwise it will contain "part".  -->
<!ATTLIST lsource ls_wasei CDATA #IMPLIED>
	<!-- The ls_wasei attribute indicates that the Japanese word
	has been constructed from words in the source language, and
	not from an actual phrase in that language. Most commonly used to
	indicate "waseieigo". -->
<!ELEMENT dial (#PCDATA)>
	<!-- For words specifically associated with regional dialects in
	Japanese, the entity code for that dialect, e.g. ksb for Kansaiben.
	-->
<!ELEMENT gloss (#PCDATA | pri)*>
	<!-- Within each sense will be one or more "glosses", i.e. 
	target-language words or phrases which are equivalents to the 
	Japanese word. This element would normally be present, however it 
	may be omitted in entries which are purely for a cross-reference.
	-->
<!ATTLIST gloss xml:lang CDATA "eng">
	<!-- The xml:lang attribute defines the target language of the
	gloss. It will be coded using the three-letter language code from
	the ISO 639 standard. When absent, the value "eng" (i.e. English)
	is the default value. -->
<!ATTLIST gloss g_gend CDATA #IMPLIED>
	<!-- The g_gend attribute defines the gender of the gloss (typically
	a noun in the target language. When absent, the gender is either
	not relevant or has yet to be provided.
	-->
<!ELEMENT pri (#PCDATA)>
	<!-- These elements highlight particular target-language words which 
	are strongly associated with the Japanese word. The purpose is to 
	establish a set of target-language words which can effectively be 
	used as head-words in a reverse target-language/Japanese relationship.
	-->
<!ELEMENT s_inf (#PCDATA)>
	<!-- The sense-information elements provided for additional
	information to be recorded about a sense. Typical usage would
	be to indicate such things as level of currency of a sense, the
	regional variations, etc.
	-->
<!-- The following entity codes are used for common elements within the
various information fields.
-->
<!ENTITY MA "martial arts term">
<!ENTITY X "rude or X-rated term (not displayed in educational software)">
<!ENTITY abbr "abbreviation">
<!ENTITY adj-i "adjective (keiyoushi)">
<!ENTITY adj-ix "adjective (keiyoushi) - yoi/ii class">
<!ENTITY adj-na "adjectival nouns or quasi-adjectives (keiyodoshi)">
<!ENTITY adj-no "nouns which may take the genitive case particle `no'">
<!ENTITY adj-pn "pre-noun adjectival (rentaishi)">
<!ENTITY adj-t "`taru' adjective">
<!ENTITY adj-f "noun or verb acting prenominally">
<!ENTITY adv "adverb (fukushi)">
<!ENTITY adv-to "adverb taking the `to' particle">
<!ENTITY arch "archaism">
<!ENTITY ateji "ateji (phonetic) reading">
<!ENTITY aux "auxiliary">
<!ENTITY aux-v "auxiliary verb">
<!ENTITY aux-adj "auxiliary adjective">
<!ENTITY Buddh "Buddhist term">
<!ENTITY chem "chemistry term">
<!ENTITY chn "children's language">
<!ENTITY col "colloquialism">
<!ENTITY comp "computer terminology">
<!ENTITY conj "conjunction">
<!ENTITY cop-da "copula">
<!ENTITY ctr "counter">
<!ENTITY derog "derogatory">
<!ENTITY eK "exclusively kanji">
<!ENTITY ek "exclusively kana">
<!ENTITY exp "expressions (phrases, clauses, etc.)">
<!ENTITY fam "familiar language">
<!ENTITY fem "female term or language">
<!ENTITY food "food term">
<!ENTITY geom "geometry term">
<!ENTITY gikun "gikun (meaning as reading) or jukujikun (special kanji reading)">
<!ENTITY hon "honorific or respectful (sonkeigo) language">
<!ENTITY hum "humble (kenjougo) language">
<!ENTITY iK "word containing irregular kanji usage">
<!ENTITY id "idiomatic expression">
<!ENTITY ik "word containing irregular kana usage">
<!ENTITY int "interjection (kandoushi)">
<!ENTITY io "irregular okurigana usage">
<!ENTITY iv "irregular verb">
<!ENTITY ling "linguistics terminology">
<!ENTITY m-sl "manga slang">
<!ENTITY male "male term or language">
<!ENTITY male-sl "male slang">
<!ENTITY math "mathematics">
<!ENTITY mil "military">
<!ENTITY n "noun (common) (futsuumeishi)">
<!ENTITY n-adv "adverbial noun (fukushitekimeishi)">
<!ENTITY n-suf "noun, used as a suffix">
<!ENTITY n-pref "noun, used as a prefix">
<!ENTITY n-t "noun (temporal) (jisoumeishi)">
<!ENTITY num "numeric">
<!ENTITY oK "word containing out-dated kanji">
<!ENTITY obs "obsolete term">
<!ENTITY obsc "obscure term">
<!ENTITY ok "out-dated or obsolete kana usage">
<!ENTITY oik "old or irregular kana form">
<!ENTITY on-mim "onomatopoeic or mimetic word">
<!ENTITY pn "pronoun">
<!ENTITY poet "poetical term">
<!ENTITY pol "polite (teineigo) language">
<!ENTITY pref "prefix">
<!ENTITY proverb "proverb">
<!ENTITY prt "particle">
<!ENTITY physics "physics terminology">
<!ENTITY quote "quotation">
<!ENTITY rare "rare">
<!ENTITY sens "sensitive">
<!ENTITY sl "slang">
<!ENTITY suf "suffix">
<!ENTITY uK "word usually written using kanji alone">
<!ENTITY uk "word usually written using kana alone">
<!ENTITY unc "unclassified">
<!ENTITY yoji "yojijukugo">
<!ENTITY v1 "Ichidan verb">
<!ENTITY v1-s "Ichidan verb - kureru special class">
<!ENTITY v2a-s "Nidan verb with 'u' ending (archaic)">
<!ENTITY v4h "Yodan verb with `hu/fu' ending (archaic)">
<!ENTITY v4r "Yodan verb with `ru' ending (archaic)">
<!ENTITY v5aru "Godan verb - -aru special class">
<!ENTITY v5b "Godan verb with `bu' ending">
<!ENTITY v5g "Godan verb with `gu' ending">
<!ENTITY v5k "Godan verb with `ku' ending">
<!ENTITY v5k-s "Godan verb - Iku/Yuku special class">
<!ENTITY v5m "Godan verb with `mu' ending">
<!ENTITY v5n "Godan verb with `nu' ending">
<!ENTITY v5r "Godan verb with `ru' ending">
<!ENTITY v5r-i "Godan verb with `ru' ending (irregular verb)">
<!ENTITY v5s "Godan verb with `su' ending">
<!ENTITY v5t "Godan verb with `tsu' ending">
<!ENTITY v5u "Godan verb with `u' ending">
<!ENTITY v5u-s "Godan verb with `u' ending (special class)">
<!ENTITY v5uru "Godan verb - Uru old class verb (old form of Eru)">
<!ENTITY vz "Ichidan verb - zuru verb (alternative form of -jiru verbs)">
<!ENTITY vi "intransitive verb">
<!ENTITY vk "Kuru verb - special class">
<!ENTITY vn "irregular nu verb">
<!ENTITY vr "irregular ru verb, plain form ends with -ri">
<!ENTITY vs "noun or participle which takes the aux. verb suru">
<!ENTITY vs-c "su verb - precursor to the modern suru">
<!ENTITY vs-s "suru verb - special class">
<!ENTITY vs-i "suru verb - irregular">
<!ENTITY kyb "Kyoto-ben">
<!ENTITY osb "Osaka-ben">
<!ENTITY ksb "Kansai-ben">
<!ENTITY ktb "Kantou-ben">
<!ENTITY tsb "Tosa-ben">
<!ENTITY thb "Touhoku-ben">
<!ENTITY tsug "Tsugaru-ben">
<!ENTITY kyu "Kyuushuu-ben">
<!ENTITY rkb "Ryuukyuu-ben">
<!ENTITY nab "Nagano-ben">
<!ENTITY hob "Hokkaido-ben">
<!ENTITY vt "transitive verb">
<!ENTITY vulg "vulgar expression or word">
<!ENTITY adj-kari "`kari' adjective (archaic)">
<!ENTITY adj-ku "`ku' adjective (archaic)">
<!ENTITY adj-shiku "`shiku' adjective (archaic)">
<!ENTITY adj-nari "archaic/formal form of na-adjective">
<!ENTITY n-pr "proper noun">
<!ENTITY v-unspec "verb unspecified">
<!ENTITY v4k "Yodan verb with `ku' ending (archaic)">
<!ENTITY v4g "Yodan verb with `gu' ending (archaic)">
<!ENTITY v4s "Yodan verb with `su' ending (archaic)">
<!ENTITY v4t "Yodan verb with `tsu' ending (archaic)">
<!ENTITY v4n "Yodan verb with `nu' ending (archaic)">
<!ENTITY v4b "Yodan verb with `bu' ending (archaic)">
<!ENTITY v4m "Yodan verb with `mu' ending (archaic)">
<!ENTITY v2k-k "Nidan verb (upper class) with `ku' ending (archaic)">
<!ENTITY v2g-k "Nidan verb (upper class) with `gu' ending (archaic)">
<!ENTITY v2t-k "Nidan verb (upper class) with `tsu' ending (archaic)">
<!ENTITY v2d-k "Nidan verb (upper class) with `dzu' ending (archaic)">
<!ENTITY v2h-k "Nidan verb (upper class) with `hu/fu' ending (archaic)">
<!ENTITY v2b-k "Nidan verb (upper class) with `bu' ending (archaic)">
<!ENTITY v2m-k "Nidan verb (upper class) with `mu' ending (archaic)">
<!ENTITY v2y-k "Nidan verb (upper class) with `yu' ending (archaic)">
<!ENTITY v2r-k "Nidan verb (upper class) with `ru' ending (archaic)">
<!ENTITY v2k-s "Nidan verb (lower class) with `ku' ending (archaic)">
<!ENTITY v2g-s "Nidan verb (lower class) with `gu' ending (archaic)">
<!ENTITY v2s-s "Nidan verb (lower class) with `su' ending (archaic)">
<!ENTITY v2z-s "Nidan verb (lower class) with `zu' ending (archaic)">
<!ENTITY v2t-s "Nidan verb (lower class) with `tsu' ending (archaic)">
<!ENTITY v2d-s "Nidan verb (lower class) with `dzu' ending (archaic)">
<!ENTITY v2n-s "Nidan verb (lower class) with `nu' ending (archaic)">
<!ENTITY v2h-s "Nidan verb (lower class) with `hu/fu' ending (archaic)">
<!ENTITY v2b-s "Nidan verb (lower class) with `bu' ending (archaic)">
<!ENTITY v2m-s "Nidan verb (lower class) with `mu' ending (archaic)">
<!ENTITY v2y-s "Nidan verb (lower class) with `yu' ending (archaic)">
<!ENTITY v2r-s "Nidan verb (lower class) with `ru' ending (archaic)">
<!ENTITY v2w-s "Nidan verb (lower class) with `u' ending and `we' conjugation (archaic)">
<!ENTITY archit "architecture term">
<!ENTITY astron "astronomy, etc. term">
<!ENTITY baseb "baseball term">
<!ENTITY biol "biology term">
<!ENTITY bot "botany term">
<!ENTITY bus "business term">
<!ENTITY econ "economics term">
<!ENTITY engr "engineering term">
<!ENTITY finc "finance term">
<!ENTITY geol "geology, etc. term">
<!ENTITY law "law, etc. term">
<!ENTITY mahj "mahjong term">
<!ENTITY med "medicine, etc. term">
<!ENTITY music "music term">
<!ENTITY Shinto "Shinto term">
<!ENTITY shogi "shogi term">
<!ENTITY sports "sports term">
<!ENTITY sumo "sumo term">
<!ENTITY zool "zoology term">
<!ENTITY joc "jocular, humorous term">
<!ENTITY anat "anatomical term">
]>
<!-- JMdict created: 2018-02-14 -->
<JMdict>
<entry>
<ent_seq>1000000</ent_seq>
<r_ele>
<reb>ヽ</reb>
</r_ele>
<sense>
<pos>&unc;</pos>
<gloss>repetition mark in katakana</gloss>
</sense>
</entry>
<entry>
<ent_seq>1000040</ent_seq>
<k_ele>
<keb>〃</keb>
</k_ele>
<r_ele>
<reb>おなじ</reb>
</r_ele>
<r_ele>
<reb>おなじく</reb>
</r_ele>
<sense>
<pos>&n;</pos>
<gloss>ditto mark</gloss>
</sense>
<sense>
<gloss xml:lang="ger">(specialcharacter) Wiederholungszeichen in Tabellen</gloss>
</sense>
<sense>
<gloss xml:lang="rus">знак "то же самое"</gloss>
</sense>
<sense>
<gloss xml:lang="spa">signo ídem</gloss>
</sense>
</entry>
<entry>
<ent_seq>1000110</ent_seq>
<k_ele>
<keb>ＣＤプレーヤー</keb>
<ke_pri>spec1</ke_pri>
</k_ele>
<k_ele>
<keb>ＣＤプレイヤー</keb>
</k_ele>
<r_ele>
<reb>シーディープレーヤー</reb>
<re_restr>ＣＤプレーヤー</re_restr>
<re_pri>spec1</re_pri>
</r_ele>
<r_ele>
<reb>シーディープレイヤー</reb>
<re_restr>ＣＤプレイヤー</re_restr>
</r_ele>
<sense>
<pos>&n;</pos>
<gloss>CD player</gloss>
</sense>
<sense>
<gloss xml:lang="fre">lecteur CD</gloss>
</sense>
<sense>
<gloss xml:lang="ger">(m) CD-Spieler</gloss>
<gloss xml:lang="ger">(m) CD-Player</gloss>
</sense>
<sense>
<gloss xml:lang="rus">CD плеер</gloss>
<gloss xml:lang="rus">проигрыватель компакт-дисков</gloss>
</sense>
<sense>
<gloss xml:lang="spa">reproductor de CD (eng: CD player)</gloss>
</sense>
</entry>
<entry>
<ent_seq>1000225</ent_seq>
<k_ele>
<keb>明白</keb>
<ke_inf>&ateji;</ke_inf>
</k_ele>
<k_ele>
<keb>偸閑</keb>
<ke_inf>&ateji;</ke_inf>
</k_ele>
<k_ele>
<keb>白地</keb>
<ke_inf>&ateji;</ke_inf>
</k_ele>
<r_ele>
<reb>あからさま</reb>
</r_ele>
<sense>
<pos>&adj-na;</pos>
<pos>&adj-no;</pos>
<misc>&uk;</misc>
<gloss>plain</gloss>
<gloss>frank</gloss>
<gloss>candid</gloss>
<gloss>open</gloss>
<gloss>direct</gloss>
<gloss>straightforward</gloss>
<gloss>unabashed</gloss>
<gloss>blatant</gloss>
<gloss>flagrant</gloss>
</sense>
<sense>
<gloss xml:lang="fre">crû</gloss>
<gloss xml:lang="fre">franc</gloss>
<gloss xml:lang="fre">candide</gloss>
<gloss xml:lang="fre">ouvert</gloss>
<gloss xml:lang="fre">direct</gloss>
<gloss xml:lang="fre">sans être embarrassé</gloss>
<gloss xml:lang="fre">sans honte</gloss>
<gloss xml:lang="fre">flagrant</gloss>
</sense>
<sense>
<gloss xml:lang="ger">klar</gloss>
<gloss xml:lang="ger">deutlich</gloss>
<gloss xml:lang="ger">ausdrücklich</gloss>
</sense>
<sense>
<gloss xml:lang="ger">offen</gloss>
<gloss xml:lang="ger">offenherzig</gloss>
<gloss xml:lang="ger">unverhohlen</gloss>
<gloss xml:lang="ger">aufrichtig</gloss>
<gloss xml:lang="ger">frisch von der Leber weg</gloss>
</sense>
<sense>
<gloss xml:lang="hun">kereken</gloss>
<gloss xml:lang="hun">nyilvánvalóan</gloss>
<gloss xml:lang="hun">világosan</gloss>
</sense>
<sense>
<gloss xml:lang="rus">очевидный</gloss>
</sense>
</entry>
<entry>
<ent_seq>1000230</ent_seq>
<k_ele>
<keb>明かん</keb>
</k_ele>
<r_ele>
<reb>あかん</reb>
</r_ele>
<r_ele>
<reb>アカン</reb>
<re_nokanji/>
</r_ele>
<sense>
<pos>&exp;</pos>
<misc>&uk;</misc>
<dial>&ksb;</dial>
<gloss>useless</gloss>
<gloss>no good</gloss>
<gloss>hopeless</gloss>
</sense>
<sense>
<gloss xml:lang="ger">schlecht</gloss>
<gloss xml:lang="ger">mies</gloss>
<gloss xml:lang="ger">blöd</gloss>
<gloss xml:lang="ger">zwecklos</gloss>
<gloss xml:lang="ger">umsonst</gloss>
</sense>
<sense>
<gloss xml:lang="ger">zu nichts nutze</gloss>
<gloss xml:lang="ger">nutzlos</gloss>
</sense>
<sense>
<gloss xml:lang="ger">unmöglich</gloss>
</sense>
<sense>
<gloss xml:lang="spa">inútil</gloss>
<gloss xml:lang="spa">no bueno</gloss>
<gloss xml:lang="spa">sin esperanza</gloss>
</sense>
</entry>
<entry>
<ent_seq>1000390</ent_seq>
<k_ele>
<keb>あっという間に</keb>
<ke_pri>spec1</ke_pri>
</k_ele>
<k_ele>
<keb>あっと言う間に</keb>
</k_ele>
<k_ele>
<keb>あっとゆう間に</keb>
</k_ele>
<k_ele>
<keb>アッという間に</keb>
</k_ele>
<k_ele>
<keb>アッと言う間に</keb>
</k_ele>
<k_ele>
<keb>アッとゆう間に</keb>
</k_ele>
<r_ele>
<reb>あっというまに</reb>
<re_restr>あっという間に</re_restr>
<re_restr>あっと言う間に</re_restr>
<re_pri>spec1</re_pri>
</r_ele>
<r_ele>
<reb>あっとゆうまに</reb>
<re_restr>あっと言う間に</re_restr>
<re_restr>あっとゆう間に</re_restr>
</r_ele>
<r_ele>
<reb>アッというまに</reb>
<re_restr>アッという間に</re_restr>
<re_restr>アッと言う間に</re_restr>
</r_ele>
<r_ele>
<reb>アッとゆうまに</reb>
<re_restr>アッと言う間に</re_restr>
<re_restr>アッとゆう間に</re_restr>
</r_ele>
<sense>
<pos>&exp;</pos>
<pos>&adv;</pos>
<gloss>just like that</gloss>
<gloss>in the twinkling of an eye</gloss>
<gloss>in the blink of an eye</gloss>
<gloss>in the time it takes to say "ah!"</gloss>
</sense>
<sense>
<gloss xml:lang="ger">im Nu</gloss>
<gloss xml:lang="ger">im Handumdrehen</gloss>
<gloss xml:lang="ger">in einem kurzen Augenblick</gloss>
</sense>
<sense>
<gloss xml:lang="spa">tal que así (lit: en lo que se tarda en decir "Ah!")</gloss>
<gloss xml:lang="spa">en un abrir y cerrar de ojos</gloss>
<gloss xml:lang="spa">en un pestañeo</gloss>
</sense>
</entry>
<entry>
<ent_seq>1004310</ent_seq>
<k_ele>
<keb>斯う</keb>
<ke_pri>spec1</ke_pri>
</k_ele>
<r_ele>
<reb>こう</reb>
<re_pri>spec1</re_pri>
</r_ele>
<sense>
<pos>&adv;</pos>
<xref>然う・1</xref>
<xref>ああ</xref>
<xref>如何・どう</xref>
<misc>&uk;</misc>
<s_inf>used for something or someone close to the speaker, including the speaker himself, or for the opinions of the speaker</s_inf>
<gloss>in this way</gloss>
<gloss>thus</gloss>
<gloss>such</gloss>
</sense>
<sense>
<pos>&int;</pos>
<misc>&uk;</misc>
<s_inf>interjection used as a verbal pause</s_inf>
<gloss>uh...</gloss>
</sense>
<sense>
<gloss xml:lang="fre">comme ceci (utilisé pour quelque chose ou quelqu'un proche du locuteur, y compris lui-même, ou à propos de ses opinions)</gloss>
<gloss xml:lang="fre">ainsi</gloss>
<gloss xml:lang="fre">de cette façon</gloss>
</sense>
<sense>
<gloss xml:lang="fre">euh... (interjection utilisée comme une pause verbale)</gloss>
</sense>
<sense>
<gloss xml:lang="ger">so</gloss>
<gloss xml:lang="ger">auf diese Weise</gloss>
<gloss xml:lang="ger">in dieser Weise</gloss>
<gloss xml:lang="ger">wie dies</gloss>
<gloss xml:lang="ger">wie folgt</gloss>
</sense>
<sense>
<gloss xml:lang="hun">ilyen</gloss>
<gloss xml:lang="hun">olyan</gloss>
</sense>
<sense>
<gloss xml:lang="rus">: {～して} так, таким образом</gloss>
<gloss xml:lang="rus">{～した} такой</gloss>
</sense>
<sense>
<gloss xml:lang="spa">de esta manera</gloss>
<gloss xml:lang="spa">así</gloss>
<gloss xml:lang="spa">tal</gloss>
</sense>
<sense>
<gloss xml:lang="spa">pausa verbal</gloss>
</sense>
</entry>
<entry>
<ent_seq>1004500</ent_seq>
<k_ele>
<keb>此方</keb>
<ke_pri>ichi1</ke_pri>
</k_ele>
<r_ele>
<reb>こちら</reb>
<re_pri>ichi1</re_pri>
</r_ele>
<r_ele>
<reb>こっち</reb>
<re_pri>ichi1</re_pri>
</r_ele>
<r_ele>
<reb>こち</reb>
<re_inf>&ok;</re_inf>
</r_ele>
<sense>
<pos>&n;</pos>
<xref>何方・どちら・1</xref>
<xref>其方・1</xref>
<xref>彼方・あちら・1</xref>
<misc>&uk;</misc>
<gloss>this way (direction close to the speaker or towards the speaker)</gloss>
<gloss>this direction</gloss>
</sense>
<sense>
<gloss>here (place close to the speaker or where the speaker is)</gloss>
</sense>
<sense>
<gloss>this one (something physically close to the speaker)</gloss>
</sense>
<sense>
<pos>&pn;</pos>
<pos>&adj-no;</pos>
<gloss>I</gloss>
<gloss>me</gloss>
<gloss>we</gloss>
<gloss>us</gloss>
</sense>
<sense>
<gloss>this person (someone physically close to the speaker and of equal or higher status)</gloss>
</sense>
<sense>
<gloss xml:lang="dut">hier</gloss>
<gloss xml:lang="dut">deze plaats</gloss>
</sense>
<sense>
<gloss xml:lang="dut">hierheen</gloss>
<gloss xml:lang="dut">hiernaartoe</gloss>
<gloss xml:lang="dut">naar deze plaats</gloss>
</sense>
<sense>
<gloss xml:lang="dut">deze zijde</gloss>
<gloss xml:lang="dut">deze kant</gloss>
</sense>
<sense>
<gloss xml:lang="dut">deze persoon</gloss>
<gloss xml:lang="dut">deze heer</gloss>
<gloss xml:lang="dut">deze dame</gloss>
<gloss xml:lang="dut">deze jongeheer</gloss>
<gloss xml:lang="dut">deze jongedame</gloss>
</sense>
<sense>
<gloss xml:lang="dut">deze zaak</gloss>
<gloss xml:lang="dut">dit voorwerp</gloss>
</sense>
<sense>
<gloss xml:lang="dut">wij</gloss>
<gloss xml:lang="dut">ik</gloss>
<gloss xml:lang="dut">onze kant</gloss>
<gloss xml:lang="dut">mijn kant</gloss>
<gloss xml:lang="dut">de groep waartoe wij behoren</gloss>
<gloss xml:lang="dut">de groep waartoe ik behoor</gloss>
<gloss xml:lang="dut">de betrokken partij waartoe wij behoren</gloss>
<gloss xml:lang="dut">de betrokken partij waartoe ik behoor</gloss>
</sense>
<sense>
<gloss xml:lang="dut">u</gloss>
<gloss xml:lang="dut">ge</gloss>
<gloss xml:lang="dut">gij</gloss>
</sense>
<sense>
<gloss xml:lang="dut">uw huis</gloss>
<gloss xml:lang="dut">uw woning</gloss>
</sense>
<sense>
<gloss xml:lang="dut">hier</gloss>
<gloss xml:lang="dut">deze plaats</gloss>
</sense>
<sense>
<gloss xml:lang="dut">deze zijde</gloss>
<gloss xml:lang="dut">deze kant</gloss>
</sense>
<sense>
<gloss xml:lang="dut">wij</gloss>
<gloss xml:lang="dut">ik</gloss>
<gloss xml:lang="dut">onze kant</gloss>
<gloss xml:lang="dut">mijn kant</gloss>
<gloss xml:lang="dut">de groep waartoe wij behoren</gloss>
<gloss xml:lang="dut">de groep waartoe ik behoor</gloss>
</sense>
<sense>
<gloss xml:lang="fre">par ici (direction proche du locuteur ou vers lui)</gloss>
<gloss xml:lang="fre">cette direction</gloss>
</sense>
<sense>
<gloss xml:lang="fre">ici (endroit où le locuteur se trouve, ou proche de lui)</gloss>
</sense>
<sense>
<gloss xml:lang="fre">celui-ci (quelque chose de physiquement proche de l'orateur)</gloss>
</sense>
<sense>
<gloss xml:lang="fre">je</gloss>
<gloss xml:lang="fre">moi</gloss>
<gloss xml:lang="fre">nous</gloss>
</sense>
<sense>
<gloss xml:lang="fre">cette personne (quelqu'un physiquement proche de l'orateur et d'un statut égal ou supérieur)</gloss>
</sense>
<sense>
<gloss xml:lang="ger">diese (f) Richtung</gloss>
<gloss xml:lang="ger">dieser (m) Weg</gloss>
</sense>
<sense>
<gloss xml:lang="ger">dieser (m) Ort</gloss>
</sense>
<sense>
<gloss xml:lang="ger">diese (f) Person</gloss>
</sense>
<sense>
<gloss xml:lang="ger">dies hier</gloss>
</sense>
<sense>
<gloss xml:lang="ger">ich</gloss>
<gloss xml:lang="ger">wir</gloss>
</sense>
<sense>
<gloss xml:lang="hun">azután</gloss>
</sense>
<sense>
<gloss xml:lang="rus">(см.) こちら</gloss>
<gloss xml:lang="rus">1) здесь; эта сторона</gloss>
<gloss xml:lang="rus">{～へ} сюда</gloss>
<gloss xml:lang="rus">{～から} отсюда</gloss>
<gloss xml:lang="rus">2) я, мы</gloss>
<gloss xml:lang="rus">3): こちらさん вы</gloss>
<gloss xml:lang="rus">1) (см.) こちら</gloss>
<gloss xml:lang="rus">2) со времени</gloss>
</sense>
<sense>
<gloss xml:lang="spa">por aquí</gloss>
<gloss xml:lang="spa">(en) esta dirección</gloss>
</sense>
<sense>
<gloss xml:lang="spa">aquí</gloss>
</sense>
<sense>
<gloss xml:lang="spa">este</gloss>
</sense>
<sense>
<gloss xml:lang="spa">yo</gloss>
</sense>
<sense>
<gloss xml:lang="spa">esta persona</gloss>
</sense>
</entry>
<entry>
<ent_seq>1330510</ent_seq>
<k_ele>
<keb>収穫</keb>
<ke_pri>ichi1</ke_pri>
<ke_pri>news1</ke_pri>
<ke_pri>nf07</ke_pri>
</k_ele>
<r_ele>
<reb>しゅうかく</reb>
<re_pri>ichi1</re_pri>
<re_pri>news1</re_pri>
<re_pri>nf07</re_pri>
</r_ele>
<sense>
<pos>&n;</pos>
<pos>&vs;</pos>
<gloss>harvest</gloss>
<gloss>crop</gloss>
<gloss>ingathering</gloss>
</sense>
<sense>
<gloss>fruits (of one's labors)</gloss>
<gloss>results</gloss>
</sense>
<sense>
<gloss xml:lang="dut">oogsten</gloss>
<gloss xml:lang="dut">binnenhalen</gloss>
<gloss xml:lang="dut">inzamelen</gloss>
<gloss xml:lang="dut">inhalen</gloss>
<gloss xml:lang="dut">plukken</gloss>
<gloss xml:lang="dut">oogst</gloss>
<gloss xml:lang="dut">pluk</gloss>
<gloss xml:lang="dut">{landb.} beschot</gloss>
<gloss xml:lang="dut">beslag</gloss>
</sense>
<sense>
<gloss xml:lang="dut">{fig.} opbrengst</gloss>
<gloss xml:lang="dut">rendement</gloss>
<gloss xml:lang="dut">{fig.} vrucht</gloss>
</sense>
<sense>
<gloss xml:lang="fre">moisson</gloss>